{
  "schema_version": 1,
  "record_type": "smb-freeze-control",
  "status": "frozen",
  "artifact_kind": "independent_units_control",
  "control_id": "independent_units_frozen",
  "content": {
    "grouping_rule_id": "source-score-group-v1",
    "pairing_rule_id": "same-page-same-condition-v1",
    "aggregation_rule_id": "source-group-mean-v1",
    "uncertainty_rule_id": "source-group-cluster-bootstrap-v1"
  }
}
